Chapter	ID	Title	AuthorList	Description
23	[JS94]	2Q: A Low Overhead High Performance Buffer Management Replacement Algorithm	T. Johnson, D. Shasha. VLDB ’94, Santiago, Chile.	A simple but effective approach to building page replacement.
23	[M04]	Cloud Atlas	D. Mitchell. Random House, 2004.	It’s hard to pick a favorite book. There are too many! Each is great in its own unique way. But it’d be hard for these authors not to pick Cloud Atlas”, a fantastic, sprawling epic about the human condition, from where the the last quote of this chapter is lifted. If you are smart – and we think you are – you should stop reading obscure commentary in the references and instead read Cloud Atlas”; you’ll thank us later.
23	[BJ81]	Converting a Swap-Based System to do Paging in an Architecture Lacking Page-Reference Bits	O. Babaoglu, W. N. Joy. SOSP ’81, Paciﬁc Grove, California, December 1981.	How to exploit existing protection machinery to emulate reference bits, from a group at Berkeley working on their own version of UNIX: the Berkeley Systems Distribution (BSD). The group was inﬂuential in the development of virtual memory, ﬁle systems, and networking.
23	[B+13]	Efﬁcient Virtual Memory for Big Memory Servers	A. Basu, J. Gandhi, J. Chang, M. D. Hill, M. M. Swift. ISCA ’13, June 2013, Tel-Aviv, Israel.	A recent work showing that TLBs matter, consuming 10% of cycles for large-memory workloads. The solution: one massive segment to hold large data sets. We go backward, so that we can go forward!
23	[C93]	Inside Windows NT	H. Custer, D. Solomon. Microsoft Press, 1993.	The book about Windows NT that explains the system top to bottom, in more detail than you might like. But seriously, a pretty good book.
23	[G+17]	KASLR is Dead: Long Live KASLR	D. Gruss, M. Lipp, M. Schwarz, R. Fellner, C. Maurice, S. Mangard. Engineering Secure Software and Systems, 2017. Available: https://gruss.cc/files/kaiser.pdf	Excellent info on KASLR, KPTI, and beyond.
23	[S+04]	On the Effectiveness of Address-space Randomization	H. Shacham, M. Page, B. Pfaff, E. J. Goh, N. Modadugu, D. Boneh. CCS ’04, October 2004.	A description of the return-tolibc attack and its limits. Start reading, but be wary: the rabbit hole of systems security is deep...
23	[RL81]	Segmented FIFO Page Replacement	R. Turner, H. Levy. SIGMETRICS ’81, Las Vegas, Nevada, September 1981.	A short paper that shows for some workloads, segmented FIFO can approach the performance of LRU.
23	[BB+72]	TENEX, A Paged Time Sharing System for the PDP-10	D. G. Bobrow, J. D. Burchﬁel, D. L. Murphy, R. S. Tomlinson. CACM, Volume 15, March 1972.	An early time-sharing OS where a number of good ideas came from. Copy-on-write was just one of those; also an inspiration for other aspects of modern systems, including process management, virtual memory, and ﬁle systems.
23	[S07]	The Geometry of Innocent Flesh on the Bone: Return-into-libc without Function Calls (on the x86)	H. Shacham. CCS ’07, October 2007.	A generalization of return-to-libc. Dr. Beth Garner said in Basic Instinct, She’s crazy! She’s brilliant!” We might say the same about ROP.
23	[C03]	The Innovator’s Dilemma	Clayton M. Christenson. Harper Paperbacks, January 2003.	A fantastic book about the disk-drive industry and how new innovations disrupt existing ones. A good read for business majors and computer scientists alike. Provides insight on how large and successful companies completely fail.
23	[BC05]	Understanding the Linux Kernel	D. P. Bovet, M. Cesati. O’Reilly Media, November 2005.	One of the many books you can ﬁnd on Linux, which are out of date, but still worthwhile.
23	[G04]	Understanding the Linux Virtual Memory Manager	M. Gorman. Prentice Hall, 2004.	An in-depth look at Linux VM, but alas a little out of date.
23	[O16]	Virtual Memory and Linux	A. Ott. Embedded Linux Conference, April 2016. https://events.static.linuxfound.org/sites/events/ﬁles/slides/elc 2016 mem.pdf .	A useful set of slides which gives an overview of the Linux VM.
23	[LL82]	Virtual Memory Management in the VAX/VMS Operating System	H. Levy, P. Lipman. IEEE Computer, Volume 15:3, March 1982.	Read the original source of most of this material. Particularly important if you wish to go to graduate school, where all you do is read papers, work, read some more papers, work more, eventually write a paper, and then work some more.
26	[SR05]	Advanced Programming in the UNIX Environment	W. Richard Stevens and Stephen A. Rago. Addison-Wesley, 2005.	As we’ve said many times, buy this book, and read it, in little chunks, preferably before going to bed. This way, you will actually fall asleep more quickly; more importantly, you learn a little more about how to become a serious U NIX programmer.
26	[L+93]	Atomic Transactions	Nancy Lynch, Michael Merritt, William Weihl, Alan Fekete. Morgan Kaufmann, August 1993.	A nice text on some of the theory and practice of atomic transactions for distributed systems. Perhaps a bit formal for some, but lots of good material is found herein.
26	[D68]	Cooperating sequential processes	Edsger W. Dijkstra. 1968. Available at this site: http://www.cs.utexas.edu/users/EWD/ewd01xx/EWD123.PDF.	Dijkstra has an amazing number of his old papers, notes, and thoughts recorded (for posterity) on this website at the last place he worked, the University of Texas. Much of his foundational work, however, was done years earlier while he was at the Technische Hochshule of Eindhoven (THE), including this famous paper on "cooperating sequential processes”, which basically outlines all of the thinking that has to go into writing multi-threaded programs. Dijkstra discovered much of this while working on an operating system named after his school: the "THE" operating system (said "T", "H", "E", and not like the word "the”).
26	[D65]	Solution of a problem in concurrent programming control	E. W. Dijkstra. Communications of the ACM, 8(9):569, September 1965.	Pointed to as the ﬁrst paper of Dijkstra’s where he outlines the mutual exclusion problem and a solution. The solution, however, is not widely used; advanced hardware and OS support is needed, as we will see in the coming chapters.
26	[GR92]	Transaction Processing: Concepts and Techniques	Jim Gray and Andreas Reuter. Morgan Kaufmann, September 1992.	This book is the bible of transaction processing, written by one of the legends of the ﬁeld, Jim Gray. It is, for this reason, also considered Jim Gray’s brain dump”, in which he wrote down everything he knows about how database management systems work. Sadly, Gray passed away tragically a few years back, and many of us lost a friend and great mentor, including the co-authors of said book, who were lucky enough to interact with Gray during their graduate school years.
26	[NM92]	What Are Race Conditions? Some Issues and Formalizations	Robert H. B. Netzer and Barton P. Miller. ACM Letters on Programming Languages and Systems, Volume 1:1, March 1992.	An excellent discussion of the different types of races found in concurrent programs. In this chapter (and the next few), we focus on data races, but later we will broaden to discuss general races as well.
27	[X+10]	Ad Hoc Synchronization Considered Harmful	Weiwei Xiong, Soyeon Park, Jiaqi Zhang, Yuanyuan Zhou, Zhiqiang Ma. OSDI 2010, Vancouver, Canada.	This paper shows how seemingly simple synchronization code can lead to a surprising number of bugs. Use condition variables and do the signaling correctly!
27	[B89]	An Introduction to Programming with Threads	Andrew D. Birrell. DEC Technical Report, January, 1989. Available: https://birrell.org/andrew/papers/035-Threads.pdf	A classic but older introduction to threaded programming. Still a worthwhile read, and freely available.
27	[B97]	Programming with POSIX Threads	David R. Butenhof. Addison-Wesley, May 1997.	Another one of these books on threads.
27	[K+96]	Programming With Threads	Steve Kleiman, Devang Shah, Bart Smaalders. Prentice Hall, January 1996.	Probably one of the better books in this space. Get it at your local library. Or steal it from your mother. More seriously, just ask your mother for it – she’ll let you borrow it, don’t worry.
27	[B+96]	PThreads Programming: by A POSIX Standard for Better Multiprocessing.	Dick Buttlar, Jacqueline Farrell, Bradford Nichols. O’Reilly, September 1996	A reasonable book from the excellent, practical publishing house O’Reilly. Our bookshelves certainly contain a great deal of books from this company, including some excellent offerings on Perl, Python, and Javascript (particularly Crockford’s Javascript: The Good Parts”.)
28	[MS91]	Algorithms for Scalable Synchronization on Shared-Memory Multiprocessors	John M. Mellor-Crummey and M. L. Scott. ACM TOCS, Volume 9, Issue 1, February 1991.	An excellent and thorough survey on different locking algorithms. However, no operating systems support is used, just fancy hardware instructions.
28	[D68]	Cooperating sequential processes	Edsger W. Dijkstra. 1968. Available online here: http://www.cs.utexas.edu/users/EWD/ewd01xx/EWD123.PDF.	One of the early seminal papers. Discusses how Dijkstra posed the original concurrency problem, and Dekker’s solution.
28	[D+13]	Everything You Always Wanted to Know about Synchronization but Were Afraid to Ask	Tudor David, Rachid Guerraoui, Vasileios Trigonakis. SOSP ’13, Nemacolin Woodlands Resort, Pennsylvania, November 2013.	An excellent paper comparing many different ways to build locks using hardware primitives. Great to see how many ideas work on modern hardware.
28	[L09]	glibc 2.9 (include Linux pthreads implementation)	Many authors.. Available here: http://ftp.gnu.org/gnu/glibc. 	In particular, take a look at the nptl subdirectory where you will ﬁnd most of the pthread support in Linux today.
28	[S05]	Guide to porting from Solaris to Linux on x86	Ajay Sood, April 29, 2005. Available: http://www.ibm.com/developerworks/linux/library/l-solar/.	
28	[D91]	Just Win, Baby: Al Davis and His Raiders	Glenn Dickey. Harcourt, 1991.	The book about Al Davis and his famous quote. Or, we suppose, the book is more about Al Davis and the Raiders, and not so much the quote. To be clear: we are not recommending this book, we just needed a citation.
28	[W09]	Load-Link, Store-Conditional	Many authors.. en.wikipedia.org/wiki/LoadLink/Store-Conditional. 	Can you believe we referenced Wikipedia? But, we found the information there and it felt wrong not to. Further, it was useful, listing the instructions for the different architectures: ldl l/stl c and ldq l/stq c (Alpha), lwarx/stwcx (PowerPC), ll/sc (MIPS), and ldrex/strex (ARM). Actually Wikipedia is pretty amazing, so don’t be so harsh, OK?
28	[H93]	MIPS R4000 Microprocessor User’s Manual	Joe Heinrich. Prentice-Hall, June 1993. Available: http://cag.csail.mit.edu/raw/documents/R4400 Uman book Ed2.pdf.	The old MIPS user’s manual. Download it while it still exists.
28	[P81]	Myths About the Mutual Exclusion Problem	G.L. Peterson. Information Processing Letters, 12(3), pages 115–116, 1981.	Peterson’s algorithm introduced here.
28	[L81]	Observations on the Development of an Operating System	Hugh Lauer. SOSP ’81, Paciﬁc Grove, California, December 1981.	A must-read retrospective about the development of the Pilot OS, an early PC operating system. Fun and full of insights.
28	[S09]	OpenSolaris Thread Library	Sun.. Code: src.opensolaris.org/source/xref/ onnv/onnv-gate/usr/src/lib/libc/port/threads/synch.c. 	Pretty interesting, although who knows what will happen now that Oracle owns Sun. Thanks to Mike Swift for the pointer.
28	[M15]	OSSpinLock Is Unsafe	J. McCall. mjtsai.com/blog/2015/12/16/osspinlock -is-unsafe.	Calling OSSpinLock on a Mac is unsafe when using threads of different priorities – you might spin forever! So be careful, Mac fanatics, even your mighty system can be less than perfect...
28	[M82]	The Architecture of the Burroughs B5000: 20 Years Later and Still Ahead of the Times?	A. Mayer. 1982. Available: www.ajwm.net/amayer/papers/B5000.html.	It (RDLK) is an indivisible operation which reads from and writes into a memory location.” RDLK is thus testand-set! Dave Dahm created spin locks (“Buzz Locks”) and a two-phase lock called Dahm Locks.”
28	[WG00]	The SPARC Architecture Manual: Version 9	D. Weaver, T. Germond. SPARC International, 2000. http://www.sparc.org/standards/SPARCV9.pdf.	See developers. sun.com/solaris/articles/atomic sparc/ for more on atomics.
28	[H91]	Wait-free Synchronization	Maurice Herlihy. ACM TOPLAS, Volume 13: 1, January 1991.	A landmark paper introducing a different approach to building concurrent data structures. Because of the complexity involved, some of these ideas have been slow to gain acceptance in deployment.
28	[R97]	What Really Happened on Mars?	Glenn E. Reeves. research.microsoft.com/en-us/um/people/mbj/Mars Pathfinder/Authoritative Account.html. 	A description of priority inversion on Mars Pathﬁnder. Concurrent code correctness matters, especially in space!
29	[L+13]	A Study of Linux File System Evolution	Lanyue Lu, Andrea C. Arpaci-Dusseau, Remzi H. Arpaci-Dusseau, Shan Lu. FAST ’13, San Jose, CA, February 2013.	Our paper that studies every patch to Linux ﬁle systems over nearly a decade. Lots of fun ﬁndings in there; read it to see! The work was painful to do though; the poor graduate student, Lanyue Lu, had to look through every single patch by hand in order to understand what they did.
29	[B+10]	An Analysis of Linux Scalability to Many Cores	Silas Boyd-Wickizer, Austin T. Clements, Yandong Mao, Aleksey Pesterev, M. Frans Kaashoek, Robert Morris, Nickolai Zeldovich . OSDI ’10, Vancouver, Canada, October 2010.	A great study of how Linux performs on multicore machines, as well as some simple solutions. Includes a neat sloppy counter to solve one form of the scalable counting problem.
29	[MS04]	Concurrent Data Structures	Mark Moir and Nir Shavit. In Handbook of Data Structures and Applications (Editors D. Metha and S.Sahni). Chapman and Hall/CRC Press, 2004. Available: www.cs.tau.ac.il/~shanir/concurrent-data-structures.pdf.	A short but relatively comprehensive reference on concurrent data structures. Though it is missing some of the latest works in the area (due to its age), it remains an incredibly useful reference.
29	[S+11]	Making the Common Case the Only Case with Anticipatory Memory Allocation	Swaminathan Sundararaman, Yupu Zhang, Sriram Subramanian, Andrea C. Arpaci-Dusseau, Remzi H. Arpaci-Dusseau . FAST ’11, San Jose, CA, February 2011.	Our work on removing possibly-failing allocation calls from kernel code paths. By allocating all potentially needed memory before doing any work, we avoid failure deep down in the storage stack.
29	[MS98]	Nonblocking Algorithms and Preemption-safe Locking on by Multiprogrammed Shared-memory Multiprocessors.	M. Michael, M. Scott. Journal of Parallel and Distributed Computing, Vol. 51, No. 1, 1998	Professor Scott and his students have been at the forefront of concurrent algorithms and data structures for many years; check out his web page, numerous papers, or books to ﬁnd out more.
29	[BH73]	Operating System Principles	Per Brinch Hansen. Prentice-Hall, 1973. Available: http://portal.acm.org/citation.cfm?id=540365.	One of the ﬁrst books on operating systems; certainly ahead of its time. Introduced monitors as a concurrency primitive.
29	[MM00]	Solaris Internals: Core Kernel Architecture	Jim Mauro and Richard McDougall. Prentice Hall, October 2000.	The Solaris book. You should also read this, if you want to learn about something other than Linux.
29	[C06]	The Search For Fast, Scalable Counters	Jonathan Corbet. February 1, 2006. Available: https://lwn.net/Articles/170003.	LWN has many wonderful articles about the latest in Linux This article is a short description of scalable approximate counting; read it, and others, to learn more about the latest in Linux.
29	[BC05]	Understanding the Linux Kernel (Third Edition)	Daniel P. Bovet and Marco Cesati. O’Reilly Media, November 2005.	The classic book on the Linux kernel. You should read it.
30	[O49]	1984	George Orwell. Secker and Warburg, 1949.	A little heavy-handed, but of course a must read. That said, we kind of gave away the ending by quoting the last sentence. Sorry! And if the government is reading this, let us just say that we think that the government is "double plus good”. Hear that, our pals at the NSA?
30	[D68]	Cooperating sequential processes	Edsger W. Dijkstra. 1968. Available online here: http://www.cs.utexas.edu/users/EWD/ewd01xx/EWD123.PDF.	Another classic from Dijkstra; reading his early works on concurrency will teach you much of what you need to know.
30	[LR80]	Experience with Processes and Monitors in Mesa	B.W. Lampson, D.R. Redell. Communications of the ACM. 23:2, pages 105-117, February 1980.	A terriﬁc paper about how to actually implement signaling and condition variables in a real system, leading to the term "Mesa" semantics for what it mzshortns to be woken up; the older semantics, developed by Tony Hoare [H74], then became known as "Hoare" semantics, which is hard to say out loud in class with a straight face.
30	[D72]	Information Streams Sharing a Finite Buffer	E.W. Dijkstra. Information Processing Letters 1: 179180, 1972. Available: http://www.cs.utexas.edu/users/EWD/ewd03xx/EWD329.PDF	The famous paper that introduced the producer/consumer problem.
30	[H74]	Monitors: An Operating System Structuring Concept	C.A.R. Hoare. Communications of the ACM, 17:10, pages 549–557, October 1974.	Hoare did a fair amount of theoretical work in concurrency. However, he is still probably most known for his work on Quicksort, the coolest sorting algorithm in the world, at least according to these authors.
30	[D01]	My recollections of operating system design	E.W. Dijkstra. April, 2001. Available: http://www.cs.utexas.edu/users/EWD/ewd13xx/EWD1303.PDF.	A fascinating read for those of you interested in how the pioneers of our ﬁeld came up with some very basic and fundamental concepts, including ideas like "interrupts" and even a stack”!
30	[L11]	Pthread cond signal Man Page	Mysterious author. March, 2011. Available online: http://linux.die.net/man/3/pthread cond signal.	The Linux man page shows a nice simple example of why a thread might get a spurious wakeup, due to race conditions within the signal/wakeup code.
31	[D59]	A Note on Two Problems in Connexion with Graphs	E. W. Dijkstra. Numerische Mathematik 1, 269–271, 1959. Available: http://www-m3.ma.tum.de/twiki/pub/MN0506/ WebHome/dijkstra.pdf.	Can you believe people worked on algorithms in 1959? We can’t. Even before computers were any fun to use, these people had a sense that they would transform the world...
31	[H87]	Aspects of Cache Memory and Instruction Buffer Performance	Mark D. Hill. Ph.D. Dissertation, U.C. Berkeley, 1987.	Hill’s dissertation work, for those obsessed with caching in early systems. A great example of a quantitative dissertation.
31	[CHP71]	Concurrent Control with Readers and Writers	P.J. Courtois, F. Heymans, D.L. Parnas. Communications of the ACM, 14:10, October 1971.	The introduction of the reader-writer problem, and a simple solution. Later work introduced more complex solutions, skipped here because, well, they are pretty complex.
31	[D68a]	Go-to Statement Considered Harmful	E.W. Dijkstra. CACM, volume 11(3), March 1968. http://www.cs.utexas.edu/users/EWD/ewd02xx/EWD215.PDF.	Sometimes thought of as the beginning of the ﬁeld of software engineering.
31	[D71]	Hierarchical ordering of sequential processes	E.W. Dijkstra. Available online here: http://www.cs.utexas.edu/users/EWD/ewd03xx/EWD310.PDF.	Presents numerous concurrency problems, including Dining Philosophers. The wikipedia page about this problem is also useful.
31	[L83]	Hints for Computer Systems Design	Butler Lampson. ACM Operating Systems Review, 15:5, October 1983.	Lampson, a famous systems researcher, loved using hints in the design of computer systems. A hint is something that is often correct but can be wrong; in this use, a signal() is telling a waiting thread that it changed the condition that the waiter was waiting on, but not to trust that the condition will be in the desired state when the waiting thread wakes up. In this paper about hints for designing systems, one of Lampson’s general hints is that you should use hints. It is not as confusing as it sounds.
31	[B04]	Implementing Condition Variables with Semaphores	Andrew Birrell. December 2004.	An interesting read on how difﬁcult implementing CVs on top of semaphores really is, and the mistakes the author and co-workers made along the way. Particularly relevant because the group had done a ton of concurrent programming; Birrell, for example, is known for (among other things) writing various thread-programming guides.
31	[D72]	Information Streams Sharing a Finite Buffer	E.W. Dijkstra. Information Processing Letters 1, 1972. http://www.cs.utexas.edu/users/EWD/ewd03xx/EWD329.PDF.	Did Dijkstra invent everything? No, but maybe close. He certainly was the ﬁrst to clearly write down what the problems were in concurrent code. However, practitioners in OS design knew of many of the problems described by Dijkstra, so perhaps giving him too much credit would be a misrepresentation.
31	[T99]	Re: NT kernel guy playing with Linux	Linus Torvalds. June 27, 1999. Available: https://yarchive.net/comp/linux/semaphores.html.	A response from Linus himself about the utility of semaphores, including the throttling case we mention in the text. As always, Linus is slightly insulting but quite informative.
31	[CB08]	Real-world Concurrency	Bryan Cantrill, Jeff Bonwick. ACM Queue. Volume 6, No. 5. September 2008.	A nice article by some kernel hackers from a company formerly known as Sun on the real problems faced in concurrent code.
31	[D08]	The Little Book of Semaphores	A.B. Downey. Available at the following site: http://greenteapress.com/semaphores/. 	A nice (and free!) book about semaphores. Lots of fun problems to solve, if you like that sort of thing.
31	[D68b]	The Structure of the THE Multiprogramming System	E.W. Dijkstra. CACM, volume 11(5), 1968.	One of the earliest papers to point out that systems work in computer science is an engaging intellectual endeavor. Also argues strongly for modularity in the form of layered systems.
31	[GR92]	Transaction Processing: Concepts and Techniques	Jim Gray, Andreas Reuter. Morgan Kaufmann, September 1992.	The exact quote that we ﬁnd particularly humorous is found on page 485, at the top of Section 8.8: The ﬁrst multiprocessors, circa 1960, had test and set instructions ... presumably the OS implementors worked out the appropriate algorithms, although Dijkstra is generally credited with inventing semaphores many years later.” Oh, snap!
32	[H93]	A Methodology for Implementing Highly Concurrent Data Objects	Maurice Herlihy. ACM TOPLAS, 15:5, November 1993.	A nice overview of lock-free and wait-free structures. Both approaches eschew locks, but wait-free approaches are harder to realize, as they try to ensure than any operation on a concurrent structure will terminate in a ﬁnite number of steps (e.g., no unbounded looping).
32	[H01]	A Pragmatic Implementation of Non-blocking Linked-lists	Tim Harris. International Conference on Distributed Computing (DISC), 2001.	A relatively modern example of the difﬁculties of building something as simple as a concurrent linked list without locks.
32	[B+87]	Concurrency Control and Recovery in Database Systems	Philip A. Bernstein, Vassos Hadzilacos, Nathan Goodman. Addison-Wesley, 1987.	The classic text on concurrency in database management systems. As you can tell, understanding concurrency, deadlock, and other topics in the world of databases is a world unto itself. Study it and ﬁnd out for yourself.
32	[K87]	Deadlock Detection in Distributed Databases	Edgar Knapp. ACM Computing Surveys, 19:4, December 1987.	An excellent overview of deadlock detection in distributed database systems. Also points to a number of other related works, and thus is a good place to start your reading.
32	[J+08]	Deadlock Immunity: Enabling Systems To Defend Against Deadlocks	Horatiu Jula, Daniel Tralamazza, Cristian Zamﬁr, George Candea. OSDI ’08, San Diego, CA, December 2008.	An excellent recent paper on deadlocks and how to avoid getting caught in the same ones over and over again in a particular system.
32	[D64]	Een algorithme ter voorkoming van de dodelijke omarming	Edsger Dijkstra. 1964. Available: http://www.cs.utexas.edu/users/EWD/ewd01xx/EWD108.PDF.	Indeed, not only did Dijkstra come up with a number of solutions to the deadlock problem, he was the ﬁrst to note its existence, at least in written form. However, he called it the "deadly embrace”, which (thankfully) did not catch on.
32	[L+08]	Learning from Mistakes — A Comprehensive Study on Real World Concurrency Bug Characteristics	Shan Lu, Soyeon Park, Eunsoo Seo, Yuanyuan Zhou. ASPLOS ’08, March 2008, Seattle, Washington.	The ﬁrst in-depth study of concurrency bugs in real software, and the basis for this chapter. Look at Y.Y. Zhou’s or Shan Lu’s web pages for many more interesting papers on bugs.
32	[T+94]	Linux File Memory Map Code	Linus Torvalds and many others. Available online at: http://lxr.free-electrons.com/source/mm/filemap.c. 	Thanks to Michael Walﬁsh (NYU) for pointing out this precious example. The real world, as you can see in this ﬁle, can be a bit more complex than the simple clarity found in textbooks...
32	[GD02]	MapReduce: Simpliﬁed Data Processing on Large Clusters	Sanjay Ghemawhat, Jeff Dean. OSDI ’04, San Francisco, CA, October 2004.	The MapReduce paper ushered in the era of large-scale data processing, and proposes a framework for performing such computations on clusters of generally unreliable machines.
