Chapter	ID	Title	AuthorList	Description
13	[M+63]	A Time-Sharing Debugging System for a Small Computer 	J. McCarthy, S. Boilen, E. Fredkin, J. C. R. Licklider. AFIPS ’63 (Spring), New York, NY, May 1963.	A great early example of a system that swapped program memory to the drum” when the program wasn’t running, and then back into core” memory when it was about to be run.
13	[S+03]	Improving the Reliability of Commodity Operating Systems 	M. M. Swift, B. N. Bershad, H. M. Levy. SOSP ’03.	The ﬁrst paper to show how microkernel-like thinking can improve operating system reliability.
13	[CV65]	Introduction and Overview of the Multics System 	F. J. Corbato, V. A. Vyssotsky. Fall Joint Computer Conference, 1965.	A great early Multics paper. Here is the great quote about time sharing: The impetus for time-sharing ﬁrst arose from professional programmers because of their constant frustration in debugging programs at batch processing installations. Thus, the original goal was to time-share computers to allow simultaneous access by several persons while giving to each of them the illusion of having the whole machine at his disposal.”
13	[R+89]	Mach: A System Software kernel 	R. Rashid, D. Julin, D. Orr, R. Sanzi, R. Baron, A. Forin, D. Golub, M. Jones. COMPCON ’89, February 1989.	Although not the ﬁrst project on microkernels per se, the Mach project at CMU was well-known and inﬂuential; it still lives today deep in the bowels of Mac OS X.
13	[L60]	Man-Computer Symbiosis 	J. C. R. Licklider. IRE Transactions on Human Factors in Electronics, HFE-1:1, March 1960.	A funky paper about how computers and people are going to enter into a symbiotic age; clearly well ahead of its time but a fascinating read nonetheless.
13	[DV66]	Programming Semantics for Multiprogrammed Computations 	Jack B. Dennis, Earl C. Van Horn. Communications of the ACM, Volume 9, Number 3, March 1966.	An early paper (but not the ﬁrst) on multiprogramming.
13	[M83]	Reminiscences on the History of Time Sharing 	John McCarthy. 1983. Available: http://www-formal.stanford.edu/jmc/history/timesharing/timesharing.html.	A terriﬁc historical note on where the idea of time-sharing might have come fzshortm, including some doubts towards those who cite Strachey’s work [S59] as the by pioneering work in this area..
13	[BH70]	The Nucleus of a Multiprogramming System 	Per Brinch Hansen. Communications of the ACM, 13:4, April 1970.	The ﬁrst paper to suggest that the OS, or kernel, should be a minimal and ﬂexible substrate for building customized operating systems; this theme is revisited throughout OS research history.
13	[S59]	Time Sharing in Large Fast Computers 	C. Strachey. Proceedings of the International Conference on Information Processing, UNESCO, June 1959.	One of the earliest references on time sharing.
13	[M62]	Time-Sharing Computer Systems 	J. McCarthy. Management and the Computer of the Future, MIT Press, Cambridge, MA, 1962.	Probably McCarthy’s earliest recorded paper on time sharing. In another paper [M83], he claims to have been thinking of the idea since 1957. McCarthy left the systems area and went on to become a giant in Artiﬁcial Intelligence at Stanford, including the creation of the LISP programming language. See McCarthy’s home page for more info: http://www-formal.stanford.edu/jmc/
13	[NS07]	Valgrind: A Framework for Heavyweight Dynamic Binary Instrumentation 	N. Nethercote, J. Seward. PLDI 2007, San Diego, California, June 2007.	Valgrind is a lifesaver of a program for those who use unsafe languages like C. Read this paper to learn about its very cool binary instrumentation techniques – it’s really quite impressive.
14	[SR05]	Advanced Programming in the UNIX Environment	W. Richard Stevens, Stephen A. Rago. Addison-Wesley, 2005.	We’ve said it before, we’ll say it again: read this book many times and use it as a reference whenever you are in doubt. The authors are always surprised at how each time they read something in this book, they learn something new, even after many years of C programming.
14	[N+07]	Exterminator: Automatically Correcting Memory Errors with High Probability	G. Novark, E. D. Berger, B. G. Zorn. PLDI 2007, San Diego, California.	A cool paper on ﬁnding and correcting memory errors automatically, and a great overview of many common errors in C and C++ programs. An extended version of this paper is available CACM (Volume 51, Issue 12, December 2008).
14	[HJ92]	Purify: Fast Detection of Memory Leaks and Access Errors	R. Hastings, B. Joyce. USENIX Winter ’92.	The paper behind the cool Purify tool, now a commercial product.
14	[W06]	Survey on Buffer Overﬂow Attacks and Countermeasures	T. Werthman. Available: www.nds.rub.de/lehre/seminar/SS06/Werthmann BufferOverﬂow.pdf.	A nice survey of buffer overﬂows and some of the security problems they cause. Refers to many of the famous exploits.
14	[KR88]	The C Programming Language	Brian Kernighan, Dennis Ritchie. Prentice-Hall 1988.	The C book, by the developers of C. Read it once, do some programming, then read it again, and then keep it near your desk or wherever you program.
14	[SN05]	Using Valgrind to Detect Undeﬁned Value Errors with Bit-precision	J. Seward, N. Nethercote. USENIX ’05.	How to use valgrind to ﬁnd certain types of errors.
15	[WL+93]	Efﬁcient Software-based Fault Isolation	Robert Wahbe, Steven Lucco, Thomas E. Anderson, Susan L. Graham. SOSP ’93.	A terriﬁc paper about how you can use compiler support to bound memory references from a program, without hardware support. The paper sparked renewed interest in software techniques for isolation of memory references.
15	[W17] Answer to footnote:	Is there anything other than havoc that can be wreaked?	Waciuma Wanjohi. October 2017.	Amazingly, this enterprising reader found the answer via google’s Ngram viewing tool (available at the following URL: http://books.google.com/ngrams). The answer, thanks to Mr. Wanjohi It’s only since about 1970 that ’wreak havoc’ has been more popular than ’wreak vengeance’. In the 1800s, the word wreak was almost always followed by ’his/their vengeance’.” Apparently, when you wreak, you are up to no good, but at least wreakers have some options now.
15	[M65]	On Dynamic Program Relocation	W.C. McGee. IBM Systems Journal, Volume 4:3, 1965, pages 184–199.	This paper is a nice summary of early work on dynamic relocation, as well as some basics on static relocation.
15	[P90]	Relocating loader for MS-DOS .EXE executable ﬁles	Kenneth D. A. Pillay. Microprocessors & Microsystems archive, Volume 14:7 (September 1990).	An example of a relocating loader for MS-DOS. Not the ﬁrst one, but just a relatively modern example of how such a system works.
15	[S04]	System Call Support	Mark Smotherman. May 2004. people.cs.clemson.edu/ ~mark/syscall.html.	A neat history of system call support. Smotherman has also collected some early history on items like interrupts and other fun aspects of computing history. See his web pages for more details.
15	[SS74]	The Protection of Information in Computer Systems	J. Saltzer and M. Schroeder. CACM, July 1974.	From this paper: The concepts of base-and-bound register and hardware-interpreted descriptors appeared, apparently independently, between 1957 and 1959 on three projects with diverse goals. At M.I.T., McCarthy suggested the base-and-bound idea as part of the memory protection system necessary to make time-sharing feasible. IBM independently developed the base-and-bound register as a mechanism to permit reliable multiprogramming of the Stretch (7030) computer system. At Burroughs, R. Barton suggested that hardware-interpreted descriptors would provide direct support for the naming scope rules of higher level languages in the B5000 computer system.” We found this quote on Mark Smotherman’s cool history pages [S04]; see them for more information.
16	[R69]	A note on storage fragmentation and program segmentation	Brian Randell. Communications of the ACM, Volume 12:7, July 1969.	One of the earliest papers to discuss fragmentation.
16	[RK68]	Dynamic Storage Allocation Systems	B. Randell and C.J. Kuehner. Communications of the ACM, Volume 11:5, May 1968.	A nice overview of the differences between paging and segmentation, with some historical discussion of various machines.
16	[W+95]	Dynamic Storage Allocation: A Survey and Critical Review	Paul R. Wilson, Mark S. Johnstone, Michael Neely, David Boles. 	International Workshop on Memory Management, Scotland, UK, September 1995. A great survey paper on memory allocators.
16	[G62]	Fact Segmentation	M. N. Greenﬁeld. Proceedings of the SJCC, Volume 21, May 1962.	Another early paper on segmentation; so early that it has no references to other work.
16	[L83]	Hints for Computer Systems Design	Butler Lampson. ACM Operating Systems Review, 15:5, October 1983.	A treasure-trove of sage advice on how to build systems. Hard to read in one sitting; take it in a little at a time, like a ﬁne wine, or a reference manual.
16	[I09]	Intel 64 and IA-32 Architectures Software Developer’s Manuals	Intel. 2009. Available: http://www.intel.com/products/processor/manuals.	Try reading about segmentation in here (Chapter 3 in Volume 3a); it’ll hurt your head, at least a little bit.
16	[CV65]	Introduction and Overview of the Multics System	F. J. Corbato, V. A. Vyssotsky. 	Fall Joint Computer Conference, 1965. One of ﬁve papers presented on Multics at the Fall Joint Computer Conference; oh to be a ﬂy on the wall in that room that day!
16	[H61]	Program Organization and Record Keeping for Dynamic Storage	A. W. Holt. Communications of the ACM, Volume 4:10, October 1961.	An incredibly early and difﬁcult to read paper about segmentation and some of its uses.
16	[K68]	The Art of Computer Programming: Volume I	Donald Knuth. Addison-Wesley, 1968.	Knuth is famous not only for his early books on the Art of Computer Programming but for his typesetting system TeX which is still a powerhouse typesetting tool used by professionals today, and indeed to typeset this very book. His tomes on algorithms are a great early reference to many of the algorithms that underly computing systems today.
16	[LL82]	Virtual Memory Management in the VAX/VMS Operating System	Henry M. Levy, Peter H. Lipman. IEEE Computer, Volume 15:3, March 1982.	A classic memory management system, with lots of common sense in its design. We’ll study it in more detail in a later chapter.
16	[DD68]	Virtual Memory, Processes, and Sharing in Multics	Robert C. Daley and Jack B. Dennis. Communications of the ACM, Volume 11:5, May 1968.	An early paper on how to perform dynamic linking in Multics, which was way ahead of its time. Dynamic linking ﬁnally found its way back into systems about 20 years later, as the large X-windows libraries demanded it. Some say that these large X11 libraries were MIT’s revenge for removing support for dynamic linking in early versions of U NIX!
17	[K65]	A Fast Storage Allocator	Kenneth C. Knowlton. Communications of the ACM, Volume 8:10, October 1965.	The common reference for buddy allocation. Random strange fact: Knuth gives credit for the idea not to Knowlton but to Harry Markowitz, a Nobel-prize winning economist. Another strange fact: Knuth communicates all of his emails via a secretary; he doesn’t send email himself, rather he tells his secretary what email to send and then the secretary does the work of emailing. Last Knuth fact: he created TeX, the tool used to typeset this book. It is an amazing piece of software 4.
17	[E06]	A Scalable Concurrent malloc(3) Implementation for FreeBSD	Jason Evans. April, 2006. http://people.freebsd.org/~jasone/jemalloc/bsdcan2006/jemalloc.pdf.	A detailed look at how to build a real modern allocator for use in multiprocessors. The "jemalloc" allocator is in widespread use today, within FreeBSD, NetBSD, Mozilla Firefox, and within Facebook.
17	[W+95]	Dynamic Storage Allocation: A Survey and Critical Review	Paul R. Wilson, Mark S. Johnstone, Michael Neely, David Boles. International Workshop on Memory Management, Scotland, UK, September 1995.	An excellent and far-reaching survey of many facets of memory allocation. Far too much detail to go into in this tiny chapter!
17	[B+00]	Hoard: A Scalable Memory Allocator for Multithreaded Applications	Emery D. Berger, Kathryn S. McKinley, Robert D. Blumofe, Paul R. Wilson. ASPLOS-IX, November 2000.	Berger and company’s excellent allocator for multiprocessor systems. Beyond just being a fun paper, also used in practice!
17	[B94]	The Slab Allocator: An Object-Caching Kernel Memory Allocator	Jeff Bonwick. USENIX ’94.	A cool paper about how to build an allocator for an operating system kernel, and a great example of how to specialize for particular common object sizes.
17	[S15]	Understanding glibc malloc	Sploitfun. February, 2015. sploitfun.wordpress.com/ 2015/02/10/understanding-glibc-malloc/.	A deep dive into how glibc malloc works. Amazingly detailed and a very cool read.
18	[I09]	Intel 64 and IA-32 Architectures Software Developer’s Manuals” Intel, 2009. Available: http://www.intel.com/products/processor/manuals.	In particular, pay attention to Volume 3A: System Programming Guide Part 1” and Volume 3B: System Programming Guide Part 2”.	
18	[KE+62]	One-level Storage System	T. Kilburn, D.B.G. Edwards, M.J. Lanigan, F.H. Sumner. IRE Trans. EC-11, 2, 1962. Reprinted in Bell and Newell, Computer Structures: Readings and Examples”. McGraw-Hill, New York, 1971.	The Atlas pioneered the idea of dividing memory into ﬁxed-sized pages and in many senses was an early form of the memory-management ideas we see in modern computer systems.
18	[L78]	The Manchester Mark I and Atlas: A Historical Perspective	S. H. Lavington. Communications of the ACM, Volume 21:1, January 1978.	This paper is a great retrospective of some of the history of the development of some important computer systems. As we sometimes forget in the US, many of these new ideas came from overseas.
19	[W03]	A Survey on the Interaction Between Caching, Translation and Protection	Adam Wiggins. University of New South Wales TR UNSW-CSE-TR-0321, August, 2003.	An excellent survey of how TLBs interact with other parts of the CPU pipeline, namely hardware caches.
19	[HP06]	Computer Architecture: A Quantitative Approach	John Hennessy and David Patterson. Morgan-Kaufmann, 2006.	A great book about computer architecture. We have a particular attachment to the classic ﬁrst edition.
19	[SB92]	CPU Performance Evaluation and Execution Time Prediction Using Narrow Spectrum Benchmarking	Rafael H. Saavedra-Barrera. EECS Department, University of California, Berkeley. Technical Report No. UCB/CSD-92-684, February 1992..	A great dissertation about how to predict execution time of applications by breaking them down into constituent pieces and knowing the cost of each piece. Probably the most interesting part that comes out of this work is the tool to measure details of the cache hierarchy (described in Chapter 5). Make sure to check out the wonderful diagrams therein.
19	[I09]	Intel 64 and IA-32 Architectures Software Developer’s Manuals	Intel, 2009. Available: http://www.intel.com/products/processor/manuals.	In particular, pay attention to Volume 3A: System Programming Guide” Part 1 and Volume 3B: System Programming Guide Part 2”.
19	[H93]	MIPS R4000 Microprocessor User’s Manual	Joe Heinrich. Prentice-Hall, June 1993. Available: http://cag.csail.mit.edu/raw/ . documents/R4400 Uman book Ed2.pdf	A manual, one that is surprisingly readable. Or is it?
19	[BC91]	Performance from Architecture: Comparing a RISC and a CISC with Similar Hardware Organization	D. Bhandarkar and Douglas W. Clark. Communications of the ACM, September 1991.	A great and fair comparison between RISC and CISC. The bottom line: on similar hardware, RISC was about a factor of three better in performance.
19	[PS81]	RISC-I: A Reduced Instruction Set VLSI Computer	D.A. Patterson and C.H. Sequin. ISCA ’81, Minneapolis, May 1981.	The paper that introduced the term RISC, and started the avalanche of research into simplifying computer chips for performance.
19	[CG68]	Shared-access Data Processing System	John F. Couleur, Edward L. Glaser. Patent 3412382, November 1968.	The patent that contains the idea for an associative memory to store address translations. The idea, according to Couleur, came in 1964.
19	[CP78]	The architecture of the IBM System/370	R.P. Case, A. Padegs. Communications of the ACM. 21:1, 73-96, January 1978.	Perhaps the ﬁrst paper to use the term translation lookaside buffer. The name arises from the historical name for a cache, which was a lookaside buffer as called by those developing the Atlas system at the University of Manchester; a cache of address translations thus became a translation lookaside buffer. Even though the term lookaside buffer fell out of favor, TLB seems to have stuck, for whatever reason.
19	[C95]	The Core of the Black Canyon Computer Corporation	John Couleur. IEEE Annals of History of Computing, 17:4, 1995.	In this fascinating historical note, Couleur talks about how he invented the TLB in 1964 while working for GE, and the fortuitous collaboration that thus ensued with the Project MAC folks at MIT.
19	[CM00]	The evolution of RISC technology at IBM	John Cocke, V. Markstein. IBM Journal of Research and Development, 44:1/2.	A summary of the ideas and work behind the IBM 801, which many consider the ﬁrst true RISC microprocessor.
19	[WG00]	The SPARC Architecture Manual: Version 9	David L. Weaver and Tom Germond. SPARC International, San Jose, California, September 2000. Available: www.sparc.org/ standards/SPARCV9.pdf.	Another manual. I bet you were hoping for a more fun citation to end this chapter.
20	[BOH10]	Computer Systems: A Programmer’s Perspective	Randal E. Bryant and David R. O’Hallaron. Addison-Wesley, 2010.	We have yet to ﬁnd a good ﬁrst reference to the multi-level page table. However, this great textbook by Bryant and O’Hallaron dives into the details of x86, which at least is an early system that used such structures. It’s also just a great book to have.
20	[M07]	Multics: History	Available: http://www.multicians.org/history.html. 	This amazing web site provides a huge amount of history on the Multics system, certainly one of the most inﬂuential systems in OS history. The quote from therein: Jack Dennis of MIT contributed inﬂuential architectural ideas to the beginning of Multics, especially the idea of combining paging and segmentation.” (from Section 1.2.1)
20	[N+02]	Practical, Transparent Operating System Support for Superpages	Juan Navarro, Sitaram Iyer, Peter Druschel, Alan Cox. OSDI ’02, Boston, Massachusetts, October 2002.	A nice paper showing all the details you have to get right to incorporate large pages, or superpages, into a modern OS. Not as easy as you might think, alas.
20	[M28]	Reese’s Peanut Butter Cups	Mars Candy Corporation. Published at stores near you. 	Apparently these ﬁne confections were invented in 1928 by Harry Burnett Reese, a former dairy farmer and shipping foreman for one Milton S. Hershey. At least, that is what it says on Wikipedia. If true, Hershey and Reese probably hate each other’s guts, as any two chocolate barons should.
20	[LL82]	Virtual Memory Management in the VAX/VMS Operating System	Hank Levy, P. Lipman. IEEE Computer, Vol. 15, No. 3, March 1982.	A terriﬁc paper about a real virtual memory manager in a classic operating system, VMS. So terriﬁc, in fact, that we’ll use it to review everything we’ve learned about virtual memory thus far a few chapters from now.
20	[JM98]	Virtual Memory: Issues of Implementation	Bruce Jacob, Trevor Mudge. IEEE Computer, June 1998.	An excellent survey of a number of different systems and their approach to virtualizing memory. Plenty of details on x86, PowerPC, MIPS, and other architectures.
21	[D97]	Before Memory Was Virtual	Peter Denning. In the Beginning: Recollections of Software Pioneers, Wiley, November 1997.	An excellent historical piece by one of the pioneers of virtual memory and working sets.
21	[G+95]	Idleness is not sloth	Richard Golding, Peter Bosch, Carl Staelin, Tim Sullivan, John Wilkes. USENIX ATC ’95, New Orleans, Louisiana.	A fun and easy-to-read discussion of how idle time can be better used in systems, with lots of good examples.
21	[CS94]	Take Our Word For it 	F. Corbato, R. Steinberg. www.takeourword.com/TOW146 (Page 4).	Richard Steinberg writes: Someone has asked me the origin of the word daemon as it applies to computing. Best I can tell based on my research, the word was ﬁrst used by people on your team at Project MAC using the IBM 7094 in 1963.” Professor Corbato replies: Our use of the word daemon was inspired by the Maxwell’s daemon of physics and thermodynamics (my background is in physics). Maxwell’s daemon was an imaginary agent which helped sort molecules of different speeds and worked tirelessly in the background. We fancifully began to use the word daemon to describe background processes which worked tirelessly to perform system chores.”
21	[LL82]	Virtual Memory Management in the VAX/VMS Operating System	Hank Levy, P. Lipman. IEEE Computer, Vol. 15, No. 3, March 1982.	Not the ﬁrst place where page clustering was used, but a clear and simple explanation of how such a mechanism works. We sure cite this paper a lot!
22	[C69]	A Paging Experiment with the Multics System	F.J. Corbato. Included in a Festschrift published in honor of Prof. P.M. Morse. MIT Press, Cambridge, MA, 1969.	The original (and hard to ﬁnd!) reference to the clock algorithm, though not the ﬁrst usage of a use bit. Thanks to H. Balakrishnan of MIT for digging up this paper for us.
22	[B66]	A Study of Replacement Algorithms for Virtual-Storage Computer	Laszlo A. Belady. IBM Systems Journal 5(2): 78-101, 1966.	The paper that introduces the simple way to compute the optimal behavior of a policy (the MIN algorithm).
22	[BNS69]	An Anomaly in Space-time Characteristics of Certain Programs Running in a Paging Machine	L. A. Belady, R. A. Nelson, G. S. Shedler. Communications of the ACM, 12:6, June 1969.	Introduction of the little sequence of memory references known as Belady’s Anomaly. How do Nelson and Shedler feel about this name, we wonder?
22	[CD85]	An Evaluation of Buffer Management Strategies for Relational Database Systems	Hong-Tai Chou, David J. DeWitt. VLDB ’85, Stockholm, Sweden, August 1985.	A famous database paper on the different buffering strategies you should use under a number of common database access patterns. The more general lesson: if you know something about a workload, you can tailor policies to do better than the general-purpose ones usually found in the OS.
22	[MM03]	ARC: A Self-Tuning, Low Overhead Replacement Cache	Nimrod Megiddo and Dharmendra S. Modha. FAST 2003, February 2003, San Jose, California.	An excellent modern paper about replacement algorithms, which includes a new policy, ARC, that is now used in some systems. Recognized in 2014 as a "Test of Time" award winner by the storage systems community at the FAST ’14 conference.
22	[H87]	Aspects of Cache Memory and Instruction Buffer Performance	Mark D. Hill. Ph.D. Dissertation, U.C. Berkeley, 1987.	Mark Hill, in his dissertation work, introduced the Three C’s, which later gained wide popularity with its inclusion in H&P [HP06]. The quote from therein: I have found it useful to partition misses ... into three components intuitively based on the cause of the misses (page 49).”
22	[EF78]	Cold-start vs. Warm-start Miss Ratios	Malcolm C. Easton, Ronald Fagin. Communications of the ACM, 21:10, October 1978.	A good discussion of cold- vs. warm-start misses.
22	[HP06]	Computer Architecture: A Quantitative Approach	John Hennessy and David Patterson. Morgan-Kaufmann, 2006. A marvelous book about computer architecture. Read it!	
22	[FP89]	Electrochemically Induced Nuclear Fusion of Deuterium	Martin Fleischmann, Stanley Pons. Journal of Electroanalytical Chemistry, Volume 26, Number 2, Part 1, April, 1989.	The famous paper that would have revolutionized the world in providing an easy way to generate nearly-inﬁnite power from jars of water with a little metal in them. Unfortunately, the results published (and widely publicized) by Pons and Fleischmann were impossible to reproduce, and thus these two well-meaning scientists were discredited (and certainly, mocked). The only guy really happy about this result was Marvin Hawkins, whose name was left off this paper even though he participated in the work, thus avoiding association with one of the biggest scientiﬁc goofs of the 20th century.
22	[M+70]	Evaluation Techniques for Storage Hierarchies	R. L. Mattson, J. Gecsei, D. R. Slutz, I. L. Traiger. IBM Systems Journal, Volume 9:2, 1970.	A paper that is mostly about how to simulate cache hierarchies efﬁciently; certainly a classic in that regard, as well for its excellent discussion of some of the properties of various replacement algorithms. Can you ﬁgure out why the stack property might be useful for simulating a lot of different-sized caches at once?
22	[KE+62]	One-level Storage System	T. Kilburn, D.B.G. Edwards, M.J. Lanigan, F.H. Sumner. IRE Trans. EC-11:2, 1962.	Although Atlas had a use bit, it only had a very small number of pages, and thus the scanning of the use bits in large memories was not a problem the authors solved.
22	[AD03]	Run-Time Adaptation in River	Remzi H. Arpaci-Dusseau. ACM TOCS, 21:1, February 2003.	A summary of one of the authors’ dissertation work on a system named River, where he learned that comparison against the ideal is an important technique for system designers.
22	[D70]	Virtual Memory	Peter J. Denning. Computing Surveys, Vol. 2, No. 3, September 1970.	Denning’s early and famous survey on virtual memory systems.
